{
  "$schema": "http://json-schema.org/draft-07/schema#",
  "$id": "https://open-ent.fr/oeip/1.0/relations-1.0.schema.json",
  "title": "OEIP 1.0 — relations.json",
  "description": "Graphe portable : les liens entre entités sont déclarés explicitement, et non déduits de la présence d'un identifiant dans un champ. Le vocabulaire est FERMÉ en 1.0 — un type de relation inconnu doit être rejeté, pas ignoré silencieusement.",
  "type": "object",

  "properties": {
    "oeipVersion": { "type": "string", "const": "1.0" },
    "sourceSystem": { "$ref": "common-1.0.schema.json#/definitions/sourceSystem" },
    "generatedAt": { "$ref": "common-1.0.schema.json#/definitions/dateTime" },
    "items": {
      "type": "array",
      "items": { "$ref": "#/definitions/relation" }
    }
  },

  "required": ["oeipVersion", "sourceSystem", "items"],
  "additionalProperties": false,

  "definitions": {

    "relationType": {
      "type": "string",
      "description": "memberOf : adhésion simple (la forme datée et qualifiée est Membership). parentOf/childOf : lien de responsabilité légale entre personnes. authoredBy/ownedBy : attribution. containedIn : appartenance à un dossier ou à une ressource conteneur. attachedTo : pièce jointe. sharedWith : partage effectif. replyTo : fil de discussion. referencedBy : citation ou lien profond. sameAs : identités équivalentes.",
      "enum": [
        "memberOf",
        "parentOf",
        "childOf",
        "authoredBy",
        "ownedBy",
        "containedIn",
        "attachedTo",
        "sharedWith",
        "replyTo",
        "referencedBy",
        "sameAs"
      ]
    },

    "relation": {
      "type": "object",
      "properties": {
        "globalId": { "$ref": "common-1.0.schema.json#/definitions/globalId" },
        "type": { "$ref": "#/definitions/relationType" },
        "fromRef": { "$ref": "common-1.0.schema.json#/definitions/globalId" },
        "toRef": { "$ref": "common-1.0.schema.json#/definitions/globalId" },
        "attributes": {
          "type": "object",
          "description": "Qualificatifs de la relation, ex. { \"permissions\": [\"read\"] } pour un sharedWith.",
          "additionalProperties": true
        }
      },
      "required": ["type", "fromRef", "toRef"],
      "additionalProperties": false
    }
  }
}
